{
  "$schema": "https://json-schema.org/draft/2020-12/schema",
  "$id": "https://ga.example/contracts/events/v1/envelope-core.schema.json",
  "title": "이벤트 Envelope 핵심 (v1, 발행자 공통)",
  "description": "발행자(ga-disclosure·엔진)가 공유하는 Envelope의 필드 집합과 형식 — 포털 설계서 v1.1 §4.1 규약. 이벤트 종류·aggregate 종류·payload는 발행자가 자기 envelope에서 allOf로 좁힌다(ga-disclosure: envelope.schema.json). 이 파일은 다른 파일을 참조하지 않는다 — 소비자가 이 파일 하나를 사본으로 가져간다. 호환성: 소비자는 모르는 필드를 무시한다. 지원하는 최대 version보다 큰 이벤트를 만나면 그 테넌트의 소비를 정지하고 운영 알림. seq 규칙(소비자): 기대값(last+1)보다 작으면 무시, 같으면 적용, 크면(갭) 정지. 테넌트는 Envelope에 없다 — 발행자 인스턴스·피드 인증이 테넌트를 정한다.",
  "type": "object",
  "required": ["eventId", "seq", "type", "version", "occurredAt", "aggregate", "payload"],
  "properties": {
    "eventId": { "$ref": "#/$defs/uuid", "description": "멱등키(발행자 안에서 유일). 소비자의 중복 제거 키" },
    "seq": { "type": "integer", "minimum": 1, "description": "발행자(테넌트) 내 단조 증가 정수. 피드는 seq 오름차순·갭 없음" },
    "type": { "type": "string", "pattern": "^[A-Z][A-Za-z0-9]{0,63}$", "description": "이벤트 타입명(발행자가 열거로 좁힌다)" },
    "version": { "type": "integer", "minimum": 1, "description": "payload 스키마 버전(정수). 필드 추가는 호환, 삭제·의미 변경·타입 변경은 version 증가" },
    "occurredAt": { "$ref": "#/$defs/instant", "description": "ISO-8601, 오프셋 포함" },
    "aggregate": {
      "type": "object",
      "required": ["kind", "id"],
      "properties": {
        "kind": { "type": "string", "pattern": "^[A-Z][A-Z0-9_]{0,31}$", "description": "집합체 종류(발행자가 열거로 좁힌다)" },
        "id": { "type": "string", "minLength": 1 }
      }
    },
    "payload": { "type": "object" }
  },
  "$defs": {
    "uuid": { "type": "string", "pattern": "^[0-9a-f]{8}-[0-9a-f]{4}-[0-9a-f]{4}-[0-9a-f]{4}-[0-9a-f]{12}$" },
    "instant": { "type": "string", "pattern": "^\\d{4}-\\d{2}-\\d{2}T\\d{2}:\\d{2}:\\d{2}(\\.\\d+)?(Z|[+-]\\d{2}:\\d{2})$" }
  }
}
