{
  "eventId": "0000000a-0000-4000-8000-00000000000a",
  "seq": 1010,
  "type": "DisclosureAbandoned",
  "version": 1,
  "occurredAt": "2026-11-10T09:00:00+09:00",
  "aggregate": {
    "kind": "DISCLOSURE",
    "id": "5b2e7c10-3f4a-4d9b-8c21-0a1b2c3d4e5f"
  },
  "payload": {
    "disclosureId": "5b2e7c10-3f4a-4d9b-8c21-0a1b2c3d4e5f",
    "abandonedAt": "2026-11-10T09:00:00+09:00"
  }
}
