{
  "eventId": "00000004-0000-4000-8000-000000000004",
  "seq": 1004,
  "type": "DisclosureCompleted",
  "version": 1,
  "occurredAt": "2026-09-23T10:04:00+09:00",
  "aggregate": {
    "kind": "DISCLOSURE",
    "id": "3f1c2b9e-8a4d-4c1e-9b7a-2d5e6f708192"
  },
  "payload": {
    "disclosureId": "3f1c2b9e-8a4d-4c1e-9b7a-2d5e6f708192",
    "disclosureNo": "T1-2026-000481",
    "completedAt": "2026-09-23T11:02:00+09:00",
    "retentionUntil": "2031-09-23"
  }
}
